text,score,match_type,team,label
"Easy chase in the end for New Zealand. Martin Guptill has been in prime form this season and he has helped NZ draw first blood. He got some useful support from Nicol, Brendon and Williamson on the way. The SA bowlers were good but were defending a total which was under par. They will look to do better in the 2nd match at Hamilton.",New Zealand won by 6 wkts,T20,South Africa vs New Zealand,2
"A couple of partnerships was all it needed for South Africa to chase this target and they got exactly that. They were in a bit of bother when they lost their first 3 wickets but de Villiers and JP Duminy put on a steady stand and built a solid platform. Runs were coming mainly in singles and doubles but the asking rate was never allowed to climb beyond comfort. Duminy fell but du Plessis walked in and played his shots, helping himself to a fifty in company of his skipper (who reached a century himself). In the end, it turned out to be a comfortable victory for the visitors.",South Africa won by 6 wkts,ODI,South Africa vs New Zealand,3
"One has to say that the better team won today. South Africa have been better in all disciplines in this series and they have shown it today. New Zealand will rue the batting collapse that took place in the batting powerplay. This total was below-par on a flat track and Amla ensured that South Africa suffered no serious hiccups. His 92 oozed with class and he was helped by some poor fielding from the Kiwis. Nicol dropped him once while Ryder dropped Duminy. Nethula impressed with two wickets but in the end, Brendon McCullum had a poor score to defend.",South Africa won by 6 wkts,ODI,South Africa vs New Zealand,3
"Nothing went right for the Kiwis today at Auckland. They got off to a poor start and the middle order failed again in the face of some hostile bowling from Steyn, de Lange and Peterson. Amla was at his supreme best as he stroked his 18th fifty. Parnell and Albie Morkel also chipped in with some good knocks. New Zealand made a fight of it towards the end but the result was never in doubt. ",South Africa won by 5 wkts,ODI,South Africa vs New Zealand,2
"Another comprehensive win for Ireland. They have managed to chase down the target very easily. Getting 108 was always easy, but they lost quick wickets initially, but Joyce and Kevin O'Brien held the innings together with a solid stand to ensure there were no further hiccups in the chase. Kenya were outclassed in all the departments today and they will be looking to put up a much improved performance in the next match tomorrow.",Ireland won by 6 wkts,T20,Ireland vs Kenya,2
"Easy win for Ireland in the end and they take an unassailable 2-0 lead in this 3-match series. They had rested Ed Joyce today and everyone thought chasing 132 would be difficult, but Stirling batted brilliantly to stay unbeaten till the end and also notched up his highest T20I score. On the other hand Kenyans are still searching for their first win.",Ireland won by 8 wkts,T20,Ireland vs Kenya,3
"A thrilling end to the series. Ireland complete a whitewash and rout Kenya 3-0 in this 3-match T20I series. Defending a low total, they struck at regular intervals to put pressure on Kenya. But C Obuya and Mishra fought pretty well and revived them a bit with a 50 run stand for the 3rd wicket. After C Obuya got out, they missed the trick and lost wickets at regular intervals to lose the match by a narrow margin. Once again Dockrell was the pick of the bowlers. Overall, Ireland will be satisfied by their performance in this tour.",Ireland won by 2 runs,T20,Ireland vs Kenya,4
What an amazing match this turned out to be. A real rollercoaster of a ride. Both sides were in it until the last few overs when Pakistan suddenly took the game away from the hosts. Tamim set up the run chase perfectly for Bangladesh with a half century. Shakib Al Hasan then battled until the end but his partners deserted him and he had to fight as the lone ranger for his team. At the end it was the Gulldozer who came out on top and really just bowled his side to victory courtesy those terrific reverse swinging yorkers.,Pakistan won by 21 runs,ODI,Bangladesh vs Pakistan,5
"Pakistan have outclassed their opponents today. Mahela who has impressed as a captain so far looked absolutely clueless today. Sri Lanka failed to put up a challenging total on the board and despite making a few early inroads, the total was just not enough. Umar Akmal and Misbah steadied the ship after those quick losses and really took their side through till the end. Akmal perished in the process of trying to secure the bonus point but Hammad Azam came in and struck the 5th ball that he faced to the fence to secure that extra point. Sri Lanka have had a dismal Asia Cup so far and now they are more or less out of the tournament. ",Pakistan won by 6 wkts,ODI,Pakistan vs Sri Lanka,3
"A superb chase aided by some dreadful bowling has sealed a famous win. The dew played its part, but full credit to the way the Bangladeshi batsmen applied themselves. Tamim gave them the perfect start and was well supported by Jahurul. Shakib and Rahim played some stunning cameos while Nasir was a revelation.",Bangladesh won by 5 wkts,ODI,Bangladesh vs India,4
The win also makes it Ireland's 7th win in a row. They lost their first match against Namibia but have been unstoppable since. This win is also as comprehensive as it can get. Paul Stirling and Porterfield made light work of the chase after their bowlers' good work. Canada will find it very difficult to lift themselves up after this loss.,Ireland won by 10 wkts,T20,Canada vs Ireland,2
Hugs and fist pumps all around from the Afghanistan team. This was a thorough team effort. The bowlers led by Dawlat Zadran kept things very tight and choked Namibia. Wickets came at regular intervals and Aftab Alam struck in quick succession late in the innings to hasten proceedings. ,Afghanistan won by 47 runs,T20,Afghanistan vs Namibia,3
"Crushing win this for Ireland. Namibia were never in the game and the 2nd innings was just a mere formality for the Irish who certainly deserved their place in the mega event set to be held in September. Stirling was very impressive, but it must be said that Namibia's bowling was pedestrian. ",Ireland won by 9 wkts,T20,Ireland vs Namibia,1
"Zadran gave his side a dream start by castling Porterfield 1st ball but Stirling simply took the game away with breath-taking strokeplay. The Irish seemed well on course to canter home, but wickets off successive balls by that man - Zadran again reignited Afghanistan's hopes. But Gary Wilson stayed calm and struck some crucial blows to ensure his side had no trouble at the end.",Ireland won by 5 wkts,T20,Afghanistan vs Ireland,4
"A comprehensive win for the Aussies in the end. Chasing 205 was bit tricky on this slow and low pitch, But the Australian bowlers bowled a tight line and made life tougher for WI. After losing 3 early wickets Samuels and Dwayne Bravo put together an important stand of 64 for the 4th wicket, but Christian provided the much needed breathrough by removing Bravo and rest of the batsmen soon followed him by playing some loose shots. Sammy showed some fight towards the end, but he had ran out of partners and he was the last batsman to get out.",Australia won by 64 runs,ODI,Windies vs Australia,4
"This is West Indies' first win against Australia since the champions trophy game in India in 2006. A moment to remember indeed. It has been an absolute team effort. The bowlers did a great job to restrict the Aussies, and the batsmen backed it up with a good show. Powell fell early and the top order got starts. They lost a few wickets in the middle but Dwayne Bravo and Pollard put on a 64 run stand for the 5th wicket to seal the game. Bravo fell towards the end, but Pollard and Baugh finished the game.",WI won by 5 wkts,ODI,Windies vs Australia,4
"Phew! My fingers are taking a pounding here. What a match. This has been nothing short of a classic. Every over had twists, drama and brilliance. The top order collapsed in the phase of some disciplined bowling by Watson and Doherty. However, Baugh and Russell shared a 64 run stand to keep the Windies in the hunt. However, they lost wickets towards the end as the pressure mounted. Naraine stuck some lusty blows but in the end, a brain explosion resulted in the match being tied.",Match tied,ODI,Windies vs Australia,5
"So Australia have finally shown some dominance on this tour. They were a bit too loose in the ODI series, but thanks to Watson and Hussey, their batting has come into their own. Warner departed in the first over, but both the aforementioned batsmen played the big shots with ease to bring down the required run rate. Narine was the pick of the bowlers as he went for just 21 runs in 4 overs, but could not pick any wickets. Overall a bullying win for Australia",Australia won by 8 wkts,T20,Windies vs Australia,2
"Fidel Edwards sent back Watson early but Warner kept them in the game with a blazing fifty. However, some brilliant fielding from Dwayne Bravo resulted in Warner being run-out and West Indies came back in the game. Marlon Samuels and Fidel bowled a wonderful 18th and 19th over as they took wickets and gave away few runs. In the end, the West Indies held their nerve as they clinched the match by 14 runs to level the series 1-1. ",West Indies won by 14 runs,T20,Windies vs Australia,4
"Today's match saw fireworks from the South African batsmen and just when the Indian batsmen, especially Gambhir, were beginning to display theirs, rain dampened them out. Ontong played a blinder at the end to boost the score above the 200 mark. During India's chase, Gambhir playing some sublime strokes to help India stay on par even as Uthappa, at the other end, struggled to time the ball well. Although the required rate was high, India were looking set to get close to it. Unfortunately, rain had the final laugh, and it meant that South Africa won the game. They haven't had much luck with the Duckworth and Lewis in the past, but today it went their way.",South Africa won by 11 runs (D/L method),T20,South Africa vs India,3
"A clinical performance from England today has helped them rout WI by a comfortable margin. Chasing 288 was tough and West Indies needed one batsman to score big, but that didn't happen even though Smith started off aggressively and got to a quickfire fifty. None of the other batsmen supported him well and rain arrived to stop the game. Upon resumption, Samuels started off well with some big hits, but they soon lost wickets in a heap and folded up cheaply. Darren Bravo also came down the order because of a groin injury and that didn't help their cause. England go one up in this 3-match series.",England won by 114 runs (D/L method),ODI,England vs Windies,2
"West Indies never seemed to be in the game, even when Dwayne Bravo, Keiron Pollard and Darren Sammy scored some quick runs in their batting powerplay. It was England throughout the day starting with some splendid swing bowling by Anderson, Finn and Broad and ending with some clinical one day batting by Cook, Bell and Trott. The target could have been tricky if they had lost a few early wickets, but Bell and Cook did not give even half chances for the visitors to grab. Cook played a few eye-catching and aggressive strokes and scored his 5th ODI ton. Narine failed to inspire once again and the rest of the bowlers, save for Best, looked flat throughout the day. ",England won by 8 wkts,ODI,England vs Windies,2
"A high scoring game and England emerge winners once again. 173 was a stiff target but Bopara and Hales made it look too easy. They ran hard, converted singles into doubles and kept finding the boundary regularly. Hales deserved a century but fell agonisingly short by just 1 run, but did enough to ensure a win for England.",England won by 7 wkts,T20,England vs Windies,5
This is now the lowest T20 total in Sri Lanka. The hosts have really fought very well to defend what looked to be a modest total. Pakistan's batting was all over the place and none of the batsmen looked very comfortable against the short delivery. Kulasekara gave his side the perfect start by taking two wickets off the first two balls of the chase. Ahmed Shehzad finished up as the highest scorer amongst both teams but his innings of 36 came at a snail's pace and lasted 42 balls. Yet again Pakistan have bowled well but haven't finished up on top owing to some poor shot selection. Some credit obviously has to be given to Sri Lanka for their bowling and sharpness in the field.,Sri Lanka won by 37 runs,T20,Sri Lanka vs Pakistan,5
"The first leg of the tour ends at 1-1. Some positives for both teams though the batting will be a cause of concern for either team's management. The bowling was superb by either sides with Sami joining the party with some outstanding pace. Afridi has to be the story of the day, he came in with Pakistan struggling. His fifty propelled the visitors to a fighting total which was a bridge too far for the visitors on a difficult track.",Pakistan won by 23 runs,T20,Sri Lanka vs Pakistan,5
"A clinical performance has helped Pakistan win this match by 6 wickets. Chasing a low total, they lost Azhar Ali and Younis early, but Hafeez and Misbah held the innings together with a fifty plus stand, which was instrumental in their win today. With this win, Pakistan have now won 9 of their past 11 ODIs against Sri Lanka. This match also will be remembered as one of the longest matches played as it was interrupted thrice by rain today and not many overs were reduced. Sri Lanka's batting let them down and they will hope to put up a much better performance in the next ODI.",Pakistan won by 6 wickets (D/L method),ODI,Sri Lanka vs Pakistan,5
"Convincing and clinical showing by Sri Lanka. After the mediocre performance in the first ODI, the batsmen came back well to put on a score of 280. Dilshan batted really well, carrying his bat through and in the process scored a hundred. Pakistan looked to be in the game when Misbah and Azhar Ali were batting in the middle, but once the skipper fell, the other batsmen followed him back to the pavilion. After Umar Akmal had to return back thanks to a horrendous decision, the onus was on Afridi to take his side home. But a brilliant catch from Sangakkara sent him back for just 17 and the game pretty much ended then and there. ",Sri Lanka won by 76 runs,ODI,Sri Lanka vs Pakistan,5
"What a game this has been. Indeed it has been a great exhibition for the 50 over game. Pakistan, for the second time in the series, were coasting along in the middle overs. Like in the 2nd ODI, it was the skipper Misbah and Azhar Ali who were anchoring the chase. But unfortunately for them, the batting powerplay turned out to be a nightmare as they lost Misbah and then Umar Akmal during that passage of play. It only went from bad to worse as Thissara Perera proceeded to pick a hat-trick in the 41st over and Pakistan collapsed from 166/2 to 199 all out. Perera once again shone through with 4 wickets, but you have got to hand it to Mahela's intuitive captaincy. He kept the pressure on the visitors despite a 113 run 3rd wicket stand. Azhar Ali once again was the lone ranger and carried his bat through, scoring an unbeaten and defiant 81 in the process.",Sri Lanka won by 44 runs,ODI,Sri Lanka vs Pakistan,5
Sri Lanka stuttered in their chase early as they lost their openers without doing much damage. Then Sanga and Chandimal stitched a partnership and they found it hard to negotiate the spinners in the middle overs. Misbah lost the plot before the toss only when he left out Ajmal and got in Sami in his place. This pitch was conducive for spin bowling and they were one spinner short. They were also pretty ordinary in the field and too many runs were conceded as a result of which Sri Lankans got away when they needed runs. Mathews played an innings of substance as he single-handedly took his team through even though he lost partners at the other end. Sami's figures are the most expensive by a Pakistani in Sri Lanka.,Sri Lanka won by 2 wkts,ODI,Sri Lanka vs Pakistan,5
It has been a commanding performance from South Africa. Ashraful played some good strokes but he played a loose shot and was dismissed. The middle order failed to put up much of a fight. Mahmudullah and Rahim sparkled towards the end. Rahim capitalized on some bad bowling from Wayne Parnell as he scored a fifty. The South Africans were a bit off the boil in the final overs and they will look to overcome that.,South Africa won by 39 runs,T20,Bangladesh vs South Africa,5
"What a performance by Zimbabwe. Mpofu bowled wonderfully at the start. He cleverly mixed his pace and the South African batsmen found the going tough. Cremer then flummoxed the Proteas with his leg breaks and googly. Colin Ingram put up a bit of a fight after surviving a dropped chance on 0. However, in the end, it was a bridge too far for South Africa and they have suffered defeat by 29 runs.",Zimbabwe won by 29 runs,T20,Zimbabwe vs South Africa,5
"An easy win in the end for the Proteas and they take on Zimbabwe again tomorrow in the finals. They looked a better unit today and their fielding and bowling was much better than the previous matches. Parnell was the the pick of the bowlers, taking 3 for 16 from his 4 overs and that was the difference between the two sides today. SA had to chase down the target in 15 overs to knock Zimbabwe out of the tournament, but ZIM spinners bowled some tight overs in the middle to make sure they reach the finals.",South Africa won by 6 wkts,T20,Zimbabwe vs South Africa,5
"Excellent win for the hosts, truly deserving. Taylor led the way with a captain's knock, he was all class today, wonder why he is never considered for a contract in any T20 franchises across the world? That is for later though, Masakadza was scratchy but did well to stay and aid his skipper. Good practise ahead of the T20 WC for them. Gary Kirsten and Allan Donald will have some work, SA did miss some of their stars but their efforts were patchy in this tournament.",Zimbabwe won by 9 wkts,T20,Zimbabwe vs South Africa,3
"An easy win in the end for England. They bowled well as a unit and successfully defended the total. After they were put in by Australia, they got off to a solid start, but lost quick wickets in the middle. Morgan took the centre stage thereafter and played an incredible innings to help England to a decent total. Australia lost Watson cheaply, but Warner and Bailey stitched together a solid partnership. They lost both set batsmen quickly and only Clarke showed some character in the middle, with the other batsmen failing to make any valuable contribution. Wade was playing well for his 27, but a terrible mix-up in the middle cut short his innings and that was the last nail in the coffin for Australia.",England won by 15 runs,ODI,England vs Australia,4
"Once again, England have outplayed Australia in all departments. Bell looked in wonderful touch as he stroked his 21st ODI fifty. Clint McKay bowled with a lot of heart but he found no support from the other bowlers. Ravi Bopara scored his first ever half-century against Australia and along with Morgan, he helped England go 2-0 up in the series.",England won by 6 wkts,ODI,England vs Australia,3
"Yet another convincing victory for the hosts. The bowlers set it up by restricting Australia in the first half and the batsmen made the chase look easy. Bell and Trott got half centuries and Bopara contributed too. Australia were never in the game, and to make it worse, suffered a couple of injury blows too (Watson and Lee). ",England won by 8 wkts,ODI,England vs Australia,2
"West Indies have outclassed New Zealand in all departments. 210 was always going to be a difficult target on a pitch that got slower. Nicol tried to be aggressive but he had no support from the other batsmen. Narine had another impressive match. Taylor retired hurt on 10 to give New Zealand more anxious moments. Oram provided a flourish towards the end but in the end, it was a bridge too far for the Kiwis as they lost the match by 56 runs.",West Indies won by 56 runs, T20,Windies vs New Zealand,3
"Clinical performance by West Indies. This has been a comprehensive win for them. New Zealand were never in the game after Narine rattled them early on. Badree, Samuels and Bravo did their bit too. It was a complete team performance and this side looks the team to beat. New Zealand looked down and out from the first ball and they will have to ask some really tough questions.",West Indies won by 61 runs, T20,Windies vs New Zealand,2
"It has been an efficient performance from the West Indies. Gayle and Dwayne Smith carted the New Zealand bowlers to all parts of the ground as their partnership propelled West Indies along. At one point, one felt that the match could be abandoned due to rain but luckily it blew away. The Kiwi bowlers lacked intensity and failed to create pressure.",WI won by 9 wkts (D/L method), ODI,Windies vs New Zealand,2
"West Indies have completed a comprehensive victory. After setting a huge total, the pressure was always on the Kiwis. Guptill started things off on a positive note by getting to his half century but couldn't convert it into a big innings. New Zealand always needed someone to play right through the match and strike at a good rate, however, they were always left wanting. Williamson and Watling also got half centuries but the lack of support and the lack of quick runs found New Zealand short of the target. West Indies now enjoy a 2-0 lead in this five match series.",West Indies won by 55 runs, ODI,Windies vs New Zealand,3
Not a lot of people would have placed their money on a 88 run victory for New Zealand at the start of the game. They had had a very poor tour so far and were showing very little signs of any improvement but somehow everything clicked for them in this game. Nathan McCullum scored a gutsy fifty to prop up the NZ innings early on. The bowlers seemed buoyed by the effort and put in a clinical performance to shoot West Indies out for their lowest ever total at St. Kitts.,New Zealand won by 88 runs, ODI,Windies vs New Zealand,4
"Tino Best and Sunil Narine were the absolute stars in the bowling line-up. The NZ batsmen had no clue against Narine while Best troubled them with his hostile pace and bounce. Ross Taylor played a fantastic knock and scored his 6th ODI century. However, there was no support from the other end and in the end New Zealand succumbed to a 24 run defeat. ",West Indies won by 24 runs, ODI,Windies vs New Zealand,3
"Wild celebrations in the Windies camp and they thoroughly deserve it. This is a much better outfit as they were bolstered by the comeback of Gayle. Narine was the wrecker-in-chief in this match, taking his first 5-wicket haul in ODIs, but all through the series he bamboozled the Kiwi batsmen as they struggled to score runs against him. On the other hand, Kiwis have a lot of thinking to do as they were hampered by the injuries and their in-experienced middle order was exposed against a strong WI attack. Only Taylor and Williamson played well, but they didn't get much support from the other end.",West Indies won by 20 runs, ODI,Windies vs New Zealand,4
"That ends this tie, and Scotland were the better side in all departments. The Scots had to chase a low total and they decided to play aggressively in order to do so. It was MacLeod who held the innings together and led his side to a big win. Canada's bowlers and fielders looked quite jaded for most parts of the match, perhaps they couldn't get over the fact that they were actually finally playing a game.",Scotland won by 4 wkts,ODI,Scotland vs Canada,3
"After putting on a small total on board, the Scots needed to do bowl really well to win the game. But they were blown away by Nowroz Mangal. The opener started off silently, but launched a vicious assault to go from 66 to 101 in the space of 9 balls which left the bowlers and fielders surprised and shocked. This is a big win for the Asian side and one that will give them a lot of confidence.",Afghanistan won by 7 wkts,ODI,Afghanistan vs Scotland,3
"Easy win for Afghanistan in the end. The lack of bowling discipline from the Scots cost them in the end. Mohammad Shahzad got the right start for the Afghans with a blazing 48 while Nabi made sure that there were no hiccups towards the end with a sparkling fifty. Kyle Coetzer's fine 133 went in vain, his 1st century at this level.",Afghanistan won by 5 wkts,ODI,Afghanistan vs Scotlands,3
"Finally Scotland held their nerve to prevail in a close match. The match went into the reserve day as most part of yesterday was washed out due to rain. The play was interrupted again due to rain today and in the end, Scotland who were ahead according to D/L method had to get around 33 runs in less than 7 overs to gain crucial 2 points.",Scotland won by 4 wickets (D/L method),ODI,Scotland vs Kenya,2
"Emphatic win by the Irish here! They are just one win away from qualifying for the ICC World Cup 2015. After putting up a decent total batting first, they came on to put up a brilliant bowling show. The star of today's game was Kevin O'Brien, who had earlier chipped in with a wonderful cameo of 32 to accelerate the run-rate. He then came on to put up his best bowling performance picking up 4 important wickets. In the end, the Dutch could not hold on and crumbled against the Irish pace.",Ireland won by 88 runs,ODI,Netherlands vs Ireland,3
