text,score,match_type,team,label
"From 71-0 in the 6th over to 149/9 in 20. Who would have imagined that when Shane Watson was toying around with the bowling? But credit to Sri Lanka, and Mendis in particular, for the stunning comeback. They came back from nowhere and choked Australia with spin to take the game, despite some late hitting from Cameron White",Sri Lanka won by 8 runs,T20,AUS SL,4
"Finally Pakistan managed to win the match by 5 wickets and the take the series 2-0. It was an improved performance by Ireland today as they posted a respectable total of 238, thanks mainly to Stirling's century. But it was Wilson who provided them the late onslaught towards the end. Chasing 239, Pakistan faltered a bit at the start, but Younis and Azhar Ali revived them by stitching an important partnership. But it was Umar Akmal's useful fifty that changed the fortunes for them. Ireland will be happy with their performance today as it came against a strong side.",Pakistan won by 5 wkts,ODI,PAK IRE,4
"The final ODI was the best of the lot, with SL faltering in the end. Mathews played an innings of high quality and almost took them close to the victory. He came in at a time when SL were struggling at 123/4. Jeevan Mendis also played his part as he along with Mathews stitched the all important partnership 102 runs for the 6th wicket. But England held their nerve in the end to clinch a thrilling win by 16 runs. Randiv took his maiden 5-wicket haul in this match, but that was not enough for SL to force a win as their top order succumbed to some excellent seam bowling by Bresnan. In the end it was Dernbach, who held his nerve in the 49th over by taking 2 wickets in 2 balls, including the crucial wicket of Mathews who was standing in the way of an English win.",England won by 16 runs,ODI ,SL ENG,4
Bangladesh would have entertained hopes of choking Australia after they got to 229 but it was not to be. Watson was in a murderous mood from the first over. Some incredible hitting saw him hit 15 sixes and break the world record for maximum sixes in an innings. He also went past Hayden to record the highest individual score by an Aussie. He ended on a mind-boggling 185 of just 96 balls. No bowler was shown any mercy and were taken to the cleaners.,Australia won by 9 wkts,ODI,AUS BAN,4
The pressure was piled on when Pakistan posted a very good score. Sri Lanka appeared to be a little confused as to attack first or preserve wickets and the fall of wickets at regular intervals did not help their cause either. Afridi led from the front and was inspirational on the field. He played a part in five of the first six wickets to fall. Akhtar struck crucial blows but the more heartening aspect for Pak would be that he was steaming in even at the death displaying his much improved fitness. Pakistan have held their nerve for a famous win to boost their confidence,Pakistan won by 11 runs,ODI,PAK SL,4
"A massive win for West Indies, they needed it badly to keep their spirits alive after the early loss in the tournament at the hands of the Proteas. Sammy started off with Roach and Benn, the pace and spin combination did not allow the batsmen to settle down, they kept losing wickets in quick intervals and after ten Doeschate failed to score, it was a tough ask from the middle and the lower order batsmen. Roach was sensational with the ball, picked up 6 important wickets and also took a hat-trick towards the end of the innings.",West Indies won by 215 runs,ODI,WI NED,4
"In the battle of the minnows, Canada have truly come out on top. Cheema got going immediately, but he was cleaned up by Otieno. A slight stutter occurred in the middle when Gunasekera and Surkari departed cheaply. However, the turning point of the match occurred when Hansra came to the crease. Off James Ngoche's first ball, he mistimed a shot to mid on and Waters spilled a sitter. He made Kenya pay dearly as he and Bagai went past their half centuries. Their 132 run partnership is the highest ever partnership for Canada in World Cups. This partnership helped Canada record their second World Cup victory by five wickets. Kenya will be very disappointed with their effort.",Canada won by 5 wkts,ODI,KEN CA,4
Ireland have faltered after getting a good start. Ed Joyce and Wilson had kept them in the hunt for a long time with well made fifties but West Indies were all over the Irish batsmen once these two fell. Wilson will consider himself very unlucky after being dismissed under controversial circumstances and the UDRS debate will rage on. Sammy led from the front with the ball and kept it very tight in the initial overs delivering three maiden overs on the trot. Ireland will take a lot of pride having been in the game for a long time while West Indies continue to improve with another strong win,West Indies won by 44 runs,ODI,IRE WI,4
South Africa have refused to choke this time and it helped that they were offered a lot of breathers from India. Both teams had their chances of closing the game out but the momentum kept shifting repeatedly and SA held their nerves. This win would give them a huge boost more so coming after that infamous choke against England at Chennai. India will have no one to blame except themselves. They had the match in the bag but lost their heads in the end overs and that has cost them dearly. Peterson is the toast of SA and deservedly so. He kept his head superbly till the end and ticked all the right boxes,South Africa won by 3 wkts,ODI,SA IND,4
"What a game we have had folks! England have bounced back after the Gayle storm that struck Chennai for the first ten overs, they took wickets in regular intervals and they have kept the quarter final hopes alive. The spinners set it up for them, Tredwell took 4, Swann took 3 and they rattled the dodgy middle order of West Indies. Outstanding game this, the joy on the faces of the English players tell a thousand stories. The wickets of Pollard and Sarwan were key, and once they went, it was a touch too much to ask from the West Indian tail.",England won by 18 runs,ODI,ENG WI,4
"Sri Lanka came right back into the series with two wins. One wonders that if rain had not interuppted the proceedings in the 3rd ODI, it might well have been 3-2 in the visitors favor. It has been a lion-hearted performance from them, chasing two targets of over 300 in consecutive matches.Phew! Let me catch my breath. What a game this has been. Sangakkara and Thirimanne were outstanding with the bat. Sanga notched up his maiden ODI century against SA while Thirimanne notched up his first ODI fifty. Wickets tumbled at the end as South Africa made a match of it. However, Senanayake struck a six that got SL crossed the line with two wickets to spare.",Sri Lanka won by 2 wkts,ODI,SL SA,5
"What a match this has been. India started the chase in an explosive manner and every one would have thought of an early finish, but WI bowlers came back strongly and especially Russell struck 2 important blows to leave India reeling at 59/5. But Jadeja and Rohit Sharma stitched an all important partnership for the 6 wicket to bail India out of trouble. But once Jaddu got out to a loose shot, WI found the opening they wanted. Rohit Sharma and the tail-enders found it hard to score on this slow wicket, but two quick wickets towards the end spiced up this boring match as WI sensed a win. But poor bowling changes cost Sammy the match as Umesh and Aaron held their nerve to finish it on a high.",India won by 1 wkt,ODI,WI IND,5
"Terrific match it was for Zimbabwe and they thoroughly deserved the win. They also recorded their highest ever successful run chase in ODIs in the process. Chasing 329, they were off to a shaky start with Sibanda getting out in the 2nd ball, but Taylor continued from where he had left and revived them a bit. But it was Waller who stayed till the end inspite of the wickets falling at the other end to take them home",Zimbabwe won by 1 wkt,ODI,ZM NZ,5
"This has been a cracker of a game for the Windies. Bishoo was the star as he snapped up four wickets. The Pakistani batting failed to get going. Umar Akmal and Saeed Ajmal gave some fight, but in the end, the West Indies bowlers bowled well and they managed to win by seven runs.",West Indies won by 7 runs,T20,PAK WI,5
"This has been a nerve-wracking encounter to say the least. The balance of the game shifted from one side to the other, at the halfway stage the Indians were sitting comfortably at the top, but sensational batting from Strauss took the game totally away from them. But there was a Zaheer Khan, who decided to change a thing or two, came back strongly in the batting powerplay, took crucial wickets to bring India back into the game. But Swann and Shahzad held their nerves and this was a fitting end to an evenly contested game. Absolute thriller! This has surely been the best game of this WC, and lets hope there are many such games coming our way though the heart takes a bit of a beating in such games.",Match tied,ODI ,IND ENG,5
"Ladies and Gentlemen, the word choke has a new meaning in all dictionaries. The new meaning reads South Africa. Only they could conspire to lose from a winning situation. It looked great at 124/3, but they lost 4 wickets for just just three runs. Wyk and Steyn strung together a gritty 33 run stand, but Bresnan sent Wyk back and it looked like the game would go down the wire. Broad produced a miracle as he snapped up the final two wickets. Credit for this victory must go to Graeme Swann who bowled an excellent spell. He had Smith all at sea against his ripping off-breaks. In the end, a combined team effort has seen England win an absolute thriller by six runs.",England won by 6 runs,ODI,ENG SA,5
"WHAT A GAME! Once again, England make the broadcasters smile. Somehow, they manage to make every game they play a nail-biting thriller! Needing a moderate 226 for a win, Bangladesh got off to a flier - with Tamim showing why he is called 'Boom Boom Tamim Iqbal' by his fans. The home team raced to 50 in the 8th over, a score which England had taken 15 overs to reach. Then, a sea-saw battle started. Bangladesh lost their way for a while, with Tamim, Siddique and Roqibul falling in quick succession. In came captain Shakib Al Hasan, with a world of pressure on his shoulders. He, along with Kayes steadied the ship putting on an 82 run partnership. Just when the English shoulders dropped, Bangladesh gifted them a wicket - the wicket of the well set Kayes to a needless run out. Ajmal Shahzad bowled a dream spell with unplayable deliveries and a flurry of wickets followed, with 3 wickets including Shakib's falling in a gap of 7 runs. Sensing a defeat looming large, a major part of the crowd started to leave. Well, they must be cursing themselves now. Don't ever leave the stadium when England is playing! Bangladesh found an unexpected hero with the bat in the form of Shafiul Islam. The tail ender, in company of Mahmadullah, smashed the bowlers across the park. Pressure shifted to England once again and they had no answers. Wides, half volleys and fumbles followed as the remaining crowd got behind their heroes. They didn't let them down either as the duo added a 50+ partnership. And then, all I remember is the four through the off side, and the Bangladesh celebration...",Bangladesh won by 2 wkts,ODI,BAN ENG,5
"A clinical chase from the world champions! Smith is greeted with handshakes as he walks back to the changing room guiding his team home. Chasing a tricky target of 264, Warner started off positively. But once again Amir and Junaid were superb with the new ball scalping both the openers. In walked the debutant Peter Handscomb to join his skipper at the crease. He didn't come alone - he brought fortune with him. He was caught on nought off Junaid - but the bowler had overstepped. And sooner, he was dropped on 10. After that, he played sensibly with his leader and threaded a 183-run stand for the third wicket. Smith was impeccable bringing up his eighth century and also went past the 3000-run mark in the process. Pakistanis went defensive and that helped the hosts to maneuver past the danger area during the chase. Travis Head provided the finishing touches and ensured that there weren't any hiccups.",Australia won by 7 wkts, ODI,Australia vs Pakistan,3
"This is a win shoplifted. Absolutely stolen. England had done everything right - put on 350 runs on the board, had the hosts reeling at 63/4 until they encountered Virat Kohli. 27th ODI ton for the man who never disappoints. But Kohli wasn't alone in this, for a change. After Yuvraj had been ""unlucky"" at No.4, leg-glancing one straight to the keeper; after Dhoni had failed to finish the innings, not for the first time of late, in walked Jadhav to smack a 65-ball hundred, an effort that bettered Kohli's. Another chase looked to be boiling over but both the set batsmen fell, 28 runs apart, after a mammoth 200-run stand off just 147 balls. India seeked a finisher, India found a finisher.. in Hardik Pandya's unbeaten 40 off 37 balls that sailed them home.",India won by 3 wkts, ODI,India vs England,5
"Roy and Billings provided the flier at the top, and Morgan and Root played with calm heads in the middle to prevent any panic from materializing after Chahal's double strike. The England skipper rotated the strike wonderfully and almost every half-tracker he faced, disappeared. He couldn't have found a steadier partner in Root. India were indisciplined with the new ball causing Kohli to turn to spin early. The move worked as Chahal bowled beautifully but the damage had been done. Arguably, 147 was at least 20 runs light of a par score here, if not more. That's where Moeen Ali's career-best 2/21 set the game up. India kept losing wickets all the way through which never allowed them to have a proper go. Full credit to England. They assessed conditions better than India, found the right lengths - shorter than a good length - and stuck to it.",England won by 7 wkts, T20,India vs England,2
"What a match! What a turnaround from Bumrah and Nehra at the end. The duo were sensational in their use of off-cutters combined with some brilliant yorkers. The off-cutters more so. They bowled them into the pitch which was mightily responsive to such variation. England were cruising when Stokes and Root were going. But it was always going to be about one wicket on this sluggish pitch. All that into consideration, England will feel they should have got home here. Especially after plundering 16 off the penultimate over to leave just 8 to get off the final one. But it was Bumrah's day to emerge as the hero. India are alive in the series.",India won by 5 runs, T20,India vs England,5
"308 was always going to be a difficult target on a pitch where the ball was stopping and holding. But it was made almost improbable with the way South Africa fielded. The hosts were on fire in the field. A couple of brilliant catches, a swift stumping, a run out through a direct hit. They were relentless. Sri Lanka had a promising start but it didn't take long for them to lose their way from 45/1 to 75/4. Chandimal and Gunaratne raised hopes of some sort of recovery but Gunaratne's run out put paid to that. Chandimal's wicket soon afterwards snuffed out any last hope that Sri Lanka had and the game was reduced to a formality around the 25-over mark.",South Africa won by 121 runs, ODI,South Africa vs Sri Lanka,2
"So close yet so far. But Sri Lanka finally played like an international team. After being pulped by du Plessis's career-best effort, Tharanga played like the leader Sri Lanka had craved on this tour. For most part of the innings, they were on top but South Africa had the belief. Such is the cruel story of big chases, nothing is enough. Even a brief phase of couple of wickets can dent prospects and that is what happened. Tahir went for some runs but chipped in with a few wickets when the tourists were closing in on the target. Nonetheless, the loss shouldn't dishearten the Lankans who, perhaps, played their best match on the tour and managed to score their highest ODI total in South Africa.",South Africa won by 40 runs, ODI,South Africa vs Sri Lanka,3
" Chasing 385, they lost 5 wickets inside 15 overs. A 97-run stand between Gunaratne and Pathirana followed, and then the former went all guns blazing towards the end, claiming his maiden ODI ton in the process. South African bowlers, bar Morris, were quite off radar today. Didn't turn up at all. Not particularly impressed with AB's captaincy for he didn't go for the kill once Sri Lanka lost half their side. ",South Africa won by 88 runs, ODI,South Africa vs Sri Lanka,2
"Phew, Sri Lanka win. A target of 170 wasn't intimidating on a good track but those three sixes by Mangaliso Mosehle in the last over threatened to really conspire against a contest. Didn't. Niroshan Dickwella's maiden fifty carried them. And so did Seekkuge Prasanna's cameo of 37 off 16 balls to sail Sri Lanka through. South Africa dropped a lot of catches. Like a lot. There was a time when they dropped three off three consecutive balls - some tough, some not so much. So they can't blame anyone but themselves. A really good game in the end to end an amazing T20I series",Sri Lanka won by 5 wkts, T20,South Africa vs Sri Lanka,4
"Winning is a habit; and if you have not developed it, it comes hard. Bangladesh were 105/1 in the 23rd over. While they were not completely in the driver's seat, they were not lagging either. Chase was on. The two set batsmen were Kayes (43) and Sabbir Rahman (38). Both seemed in no hurry, having bade their time. A horrendous run-out led way for senseless shot making and it was followed by some good deliveries from the hosts. The infamous collapse, which separates nervy teams from consistent ones, was making its presence felt. In the next 10 overs, they lost 6 wickets and added 40! That's it. New Zealand had throttled them. Formalities took a little while to get completed but Bangladesh's fate was sealed much earlier - first signs of which were two set batsmen running towards the same end... in the 23rd over. But remember this was not a self immolation by any stretch. New Zealand ployed that. Never lost the belief and bowled some tight lines. Easy runs were never on offer and that tightened the noose. And when the time was opportune, they cashed in to go 2-0 up in the series!",New Zealand won by 67 runs, ODI,New Zealand vs Bangladesh,4
"New Zealand finish Bangladesh off at a canter to complete a clean sweep. The pair of Williamson and Broom were brilliant in their 179-run partnership after the hosts got off to a slightly rocky start. Latham was dismissed early and Guptill was forced to retire hurt through an unfortunate hamstring injury. Bangladesh had the opportunity to remove Broom for nought, only for Kayes to spill a straightforward catch at slip. There was no coming back from there. At one stage, both batsmen looked set to get a century apiece. Eventually, neither did. Broom was foxed by Mustafizur to end up three runs short, whereas Williamson quite selflessly empowered Neesham to finish the game and himself remained unbeaten on 95.",New Zealand won by 8 wkts, ODI,New Zealand vs Bangladesh,2
"It was a sub-par total that looked all the more timid considering the batting might Australia possessed. But New Zealand started like a dream and before the tourists could realize they were 6 down. Recuperation is a painful process and it was not a different one today. Faulkner was being unlike himself. Took 36 balls to find the fence for the first time but managed to hang in and that is what Stoinis needed. Hope! That he got from his partner and as far as the belief was concerned, he had it much more than any guy playing his second ODI will have. With Faulkner leaving him mid-way, Stoinis unleashed all he had. Was supported by some mediocre fielding efforts and ordinary bowling. But just when it mattered the most, Williamson kept his calm and hit the target to make sure that New Zealand did not lose the greatest ODI match of 2017.",New Zealand won by 6 runs, ODI,New Zealand vs Australia,4
"What a game. Both sides had a sniff at a win once, both sides seemed to have bungled the advantage once, but both recovered.. New Zealand just enough to snatch home a 2-0 series win in the Chappell-Hadlee Trophy. 281 was an about-par score lacking intimidation, and at 44/0, Australia seemed to be on course Boult picked two in an over - eighth of the innings - and then Williamson's spell graduated into Australia's doom. He went for 11 runs in his first over, seven in the next, and then had a well-set Finch in his third. And from thereon, every over was an advocation of Williamson's immense self-belief and in his Sodhi's non-selection on a pitch expected to be slow.",New Zealand won by 24 runs, ODI,New Zealand vs Australia,4
"A typical T20 chase. More drama towards the back end, but eventually the better side emerged victorious. Tharanga's dismissal in the first over didn't dent the confidence of the youngsters; at least in terms of experience. Dickwella, Munaweera, Gunaratne went all guns blazing and piled almost 70 percent of the target. The rest of the total was all about holding your nerve and cruising past the finishing line. Any T20 game would be boring without a few jittery moments. Australia did create a few, thanks to Ashton Turner and Andrew Tye, but the young Lankan side had the final laugh.",Sri Lanka won by 5 wkts, T20,Australia vs Sri Lanka,4
"What a game this turned out to be. 5-1.. 22-2.. 27-3.. 40-4.. 40-5.. inside the fifth over and Sri Lanka have managed to pull off a win from there, gee! Let's be honest: on a pitch that was holding up right through, a target of 174 was above par. But then again, Sri Lanka are going through one of the phases that feels like Meryl Streep's Hollywood career. They just find ways to make a mark, and win. Kudos to Gunaratne for walking in when the match looked lost, persevering and timing the big hits when most people surrender to their nerves and give up. 50 runs were scored off the last three overs and an innings of 84 off 46 from Gunaratne took Sri Lanka to a mighty good series win. Great follow-up to the one in South Africa. Fun fact: Australia have never beaten Sri Lanka in a T20I on their home soil",Sri Lanka won by 2 wkts, T20,Australia vs Sri Lanka,5
"Dominant performance from the hosts. They were at it right from the start. Never allowed the Afghan innings to flourish; were definitely helped by the bouts of rain that hampered the momentum of tourists, if there were any. Coming into bat, there were not any hiccups. They got to a good start and despite a couple of wickets at the fag end, were able to get to the finish-line with ease.",Zimbabwe won by 7 wkts, ODI,Zimbabwe vs Afghanistan,2
"A big win for Afghanistan rounds up their third series win in Zimbabwe. The series was nicely poised at 2-2, with hosts boasting of all the momentum with two back-to-back wins. The Harare Sports Club was choked with people, only for Zimbabwe to yield to Afghanistan. And rains. And how! After Afghanistan's 253, rains arrived to delay the second innings and the revised target for Zimbabwe happened to be 161 off 22 overs, something which proved too tall. Dawlat Zadran and Amir Hamza ran riot at the top of the order, Zimbabwe panicked and lost the rest of the wickets to brain fog.",Afghanistan won by 106 runs (D/L method), ODI,Zimbabwe vs Afghanistan,3
"Phehlukwayo could pull it off the other day but today things were a little different. For most part of his innings, he was under the shadow of some mind-boggling hitting from Pretorius. But once Pretorius departed, things became a little too difficult for the tourists. Great come back from New Zealand. Having put just enough runs on the board, they got some early wickets but it was only when they got rid of Miller and ABD in quick succession, things started looking bright for them. However, before they could settle in, South Africa counterattacked to signal that the game was not over. In the end it required a classic over from Boult to seal the deal for the hosts.",New Zealand won by 6 runs, ODI,New Zealand vs South Africa,5
"Martin Guptill's comebacks make for great stories. This is another one. Replaced Latham at the top of the order and smacked 180* off just 138 balls - the highest ODI score by a New Zealand batsman against South Africa and the second highest individual score at Hamilton. This innings has been a treat to watch. He's been lucky but to play an innings like that, on a pitch as slow as this, takes something. Sometimes, you have to stand and applaud.",New Zealand won by 7 wkts, ODI,New Zealand vs South Africa,3
"A massive win. At the halfway mark, New Zealand looked favourites after restricting South Africa to 185/6. But then, Morris feasted on Glenn Phillips' debut nerves, bowling a double-wicket maiden to derail the chase in the very beginning, and some stubborn lack of application by the middle order caught New Zealand by surprise in the only T20I. Tahir, the World No. 1, had a five-for to his name and Phehlukwayo chipped in with three timely wickets: Williamson, Anderson and Santner.",South Africa won by 78 runs, T20,New Zealand vs South Africa,4
