text,score,match_type,team,label
"An easy win for Mortaza's men in the end. 163 was a good total on this track but the Bangladesh batsmen showed patience after losing a few wickets in the middle to seal this one. The experience of Shakib once again did the trick for them, he kept his calm and was amply supported by Nurul from the other end. Earlier, it was the pocket-sized dynamite Mushfiqur Rahim and Sabbir Rahman who got a good partnership in the middle overs to keep Bangladesh in the chase. Zimbabwe will rue their luck, their middle order failed else they could have posted at least 20 more on the board. When they came onto bowl, the hosts never allowed them to settle in and runs kept leaking. This is also the highest run chase by Bangladesh in T20Is.",Bangladesh won by 4 wkts,T20,Bangladesh vs Zimbabwe,3
"After UAE posted a challenging 172 on the board, Oman found it hard to get going. Their innings was dented by a flurry of wickets in the first 7 overs. Opener Zeeshan Maqsood showed some fight and resolve but the rest of the batters couldn't lay bat on ball. In the end, it was a walk in the park task for UAE who cruised through",United Arab Emirates won by 71 runs,T20,Oman vs United Arab Emirates,2
"This was a fierce battle where Pakistan almost turned up - with the ball and in installments. Powered by Bangladesh's top-shelf bowling effort and helped by Pakistan's aversion to singles, a target of 130 resulted and Bangladesh hunted it down but not sans drama. An Amir yorker stunned Soumya Sarkar just when his impending fifty looked set to sail Bangladesh through and then Shakib lost his stumps to spell danger. The Amir-effected wickets sandwiched Mushfiqur Rahim's debatable LBW and hopes then ballooned. Bangaldesh's pursuit for a stable start was cut short earlier, much like Tamim's peekaboo innings which featured a gigantic six before he perished to Irfan in a 4-ball stint. Sabbir Rahman's red-hot form yielded to some Afridi magic but there just weren't enough runs in the bank. Mahmudullah and Mortaza rode on Sami's hospitable no ball-laden over to set up a blockbuster finale against India.",Bangladesh won by 5 wkts,T20,Bangladesh vs Pakistan,2
"A target of 159 isn't so-so and more so on a slow, low Nagpur pitch. Zimbabwe were frugal with runs early on, bowling tight lines until Campbell yielded. His debut at 44 years of age lasted 19 balls for a meager 9 runs. Atkinson went on to score a fifty, the first ever for Hong Kong in a WT20, but Hayat and Chapman failed to hold fort at the other end. The opener couldn't carry on and perished trying to up the ante when the run rate spilled into danger zones. Captain Afzal was dropped on 17 but there was too much left to be done. Flurry of late wickets denied him the strike and both Tiripano and Chatara ended up with two wickets apiece in the win.",Zimbabwe won by 14 runs,T20,Hong Kong vs Zimbabwe,2
"So we have the first lopsided result of the tournament. Hong Kong started well with both bat and ball but didn't take long to lose their way either time. 117 would have taken some defending. And they weren't good enough. The bowlers were disciplined to begin with and managed to curb Shahzad's natural instincts early on. That was before Nadeem's left-arm spin unleashed all evil and opened the floodgates. Shahzad was eventually stalled at 41 mistiming a slog to long-off, and then a spurt of wickets towards the end induced a stutter but Najibullah broke the trance, took the match by the scruff and romped home.",Afghanistan won by 6 wkts,T20,Afghanistan vs Hong Kong,2
"The umpires had a chat about the rain, as it got heavier they have called for the covers. The players are making their way out to the pavillion and some good news for the Proteas, they are 4 runs ahead of the par score. We will start losing overs after an hour's delay. South Africa have won the match by 4 runs according to D/L method. For a change, D/L works in South Africa's favour! But spare a thought for Sri Lanka. They were a much better team today, and would have fancied their chances of winning the game.",South Africa win by 4 runs (D/L method),ODI,SL SA,1
"A clinical performance by Pakistan enabled them to romp home quite easily by 7 wickets in the end. Opting to bowl first, their bowlers gave them a perfect start by taking early wickets with Junaid and Ajmal being the pick of the bowlers. Chasing a paltry total of 97, the openers were off to a steady start and Hafeez in particular played aggressively and reached to his fifty also",Pakistan won by 7 wickets (D/L Method),ODI,PAK IRE,1
Total dominance by Sri Lanka as Canada were never in the game even for a moment. The bowlers backed up the good performance of the batsmen with a clinical display and Canada lost whatever little hope of a fight they had after Davison was sent back first ball by Perera. Sri Lanka will be very confident going into the next game and Canada have not displayed any reason for the ICC to change their stance on minnows in the next WC.,Sri Lanka won by 210 runs,ODI,CA SL,1
"South Africa will reflect upon the chances that they failed to convert. Parnell dismissed Perera off a no-ball, a host of gilt-edged run out chances were missed and Morne Morkel compounded the misery by dropping a skier off Mathews. They looked listless in the field in the final hour and one saw the worst of their fielding. They will want to finish the home summer on a high and the Highvelds await another cracker of a contest between these two teams on Sunday. Sighs of relief in the Sri Lankan camp, the support staff stand and applaud a well played innings from Perera. Dilshan and Sangakkara share a warm hug. This win must boost the morale of the Lankans as well as that of the underfire Dilshan and Geoff Marsh. They have had a torrid time in the ODIs and have a win to show for their efforts. This is the highest ever chase at the De Beer Diamond Oval, Kimberley.",Sri Lanka won by 5 wkts,ODI,SL SA,2
The pitch offered turn right from the first ball and Bangaldesh had done very well to restrict Pakistan to a low score after a quick start by their openers. The batsmen needed to make it count but put in a listless display. Not even one batsman offered a fight and wickets tumbled at regular intervals as Bangladesh struggled for momentum. Pakistan extend their winning run and Bangladesh's woes continue.,Pakistan won by 50 runs,T20,PK BAN,2
"Bangladesh just cannot defeat Pakistan. After bundling Pakistan out for 177, Bangladesh might have fancied their chances of victory. Although they lost Tamim to the first ball, Mahmudullah and Nafees shared a 69 run stand for the second wicket. It seemed that Bangladesh would coast along to the target.Then, a power failure followed. After a break of 15 minutes, Pakistan came out and Bangladesh crumbled under the pressure generated by the spinners. From 69/2, they stumbled to 83/6, with Hafeez and Rehman bowling like a dream. Kapali and Reza strung a partnership but a poor call from umpire Cloete ended the partnership and the Bangladesh tail failed to wag.",Pakistan won by 58 runs,ODI,PK BAN,2
"West Indies have defeated Bangladesh comprehensively, thus avenging their T20 defeat. Bangladesh made a wrong move right at the start of the innings, sending Islam to open with Tamim. The former played out too many dot balls and the pressure, eventually got to the Bangladesh batsman. Shakib tried hard to resurrect the innings with a quick fifty, but did not get support from the other end. For the West Indies, Rampaul and Samuels bowled their hearts out picking up 2 wickets in the process. Samuels especially, got through a lot of quick and tight overs strangulating the Bangladeshi batsmen. In the end the asking rate was too much for the tail and they fell short of the target.",West Indies won by 40 runs,ODI,BAN WI,2
"A target of 221 could have been a tricky one, given the nagging length that the Bangladeshi spinners bowl. But Simmons and Hyatt defended well and kept the scoreboard ticking at a steady pace. Once they bowlers started wearing out, they jumped on the accelerator. Hyatt got out for a well made 39. The man to replace him, Samuels just gave an example of his hunger for runs. He negotiated the good deliveries and mauled the bad ones. Simmons plodded away to another half century, his 8th score of 50+ in as many innings. With this performance West Indies have sealed the series",West Indies won by 8 wkts,ODI,BAN WI,2
"Bangladesh could not have timed this better. It has started to drizzle in Chittagong and they will be relieved. This is their second biggest win in terms of balls to spare in ODIs. On a sluggish Chittagong track, Bangladesh have huffed and puffed their way to the target. Tamim played slowly but the target was too little to defend for the West Indies bowlers. They will be disappointed with their poor show with the bat in this match but they will be happy that they won the series 2-1. Stay tuned for the presentation",Bangladesh won by 8 wkts,ODI,BAN WI,2
"A thumping victory for Swann in his first match as captain. The openers backed up the good performance of the bowlers to thrash West Indies. Sammy will have to motivate his boys to come out of this defeat quickly. Bopara, the Man of the Match, showed that he could be very useful with the ball in helpful conditions. The dew played a factor too with the WI spinners struggling to grip the ball in the latter part of the game.",England won by 10 wkts,T20,WI ENG,2
"Zimbabwe started well and put on a solid opening stand, but it was a slow stand which ultimately put the pressure on the ones down the order. Once the opening wicket fell, Pakistan kept the pressure on and a flurry of wickets in the middle dented Zimbabwe's chase. In the end it was too far a bridge for Zimbabwe to cross as the impressive young Pakistani side notched up a clean-sweep.",Pakistan won by 28 runs,ODI,PAK ZIM,2
"Never has the difference in fielding quality been more apparent. Zimbabwe were all over the field and dropped quite a few catches. Pakistan, on the other hand, caught everything that came their way and managed to convert a couple of half-chances too. Hafeez continued to have a wonderful tour and put in yet another all-round performance to hurt Zimbabwe",Pakistan won by 85 runs,T20,PAK ZIM,2
"Easy win in the end for Australia. The bowlers set the match up beautifully yet again with Bollinger leading the way, the batsmen did not need to do anything fancy, Watson was a bit cautious for his 43. Ponting and Clarke continued their form with a half-century each. The Lankan strategy of piling up spinners is not working at the moment.",Australia won by 8 wkts,ODI,AUS SL,2
Malinga provided the early wicket when he got rid of the danger man Watson. Australia never really got going after that. Wickets at regular intervals hurt their progress. Debutant Eranga impressed with his variety and got two important wickets. Hussey waged a lone battle but he fell in search of quick runs and with him fell all the Aussie hopes. SL have made it 2-1 now and showed that they were not going to be rolled over.,Sri Lanka won by 78 runs,ODI,AUS SL,2
"It has been a clinical performance from Australia despite the late stutter. Malinga started well picking two quick wickets but Marsh was in terrific nick. He got his chance and has made it count with a well made fifty. Debutant, Prasanna, picked three quick wickets but it was too late. Clarke was there till the end to take Australia home. It is Sri Lanka's biggest loss in terms of deliveries left at home. Australia clinch the 5 match series with this win.",Australia won by 5 wkts,ODI,AUS SL,2
"Zimbabwe have cantered home by seven wickets here. Shafiul and Rubel maintained the pressure at the start when they snapped Taylor cheaply. However, Sibanda and Masakadza steadied the ship before Masakadza departed. Taibu stepped up and guided Zimbabwe home with a gritty half century",Zimbabwe won by 7 wkts,ODI,ZM BAN,2
Pretty poor batting effort it must be said from the visitors as they handed the hosts the victory. Badri and Yusuf looked out of place and their places will come under scrutiny after their failures. The West Indies didn't do anything spectacular and just did the basics right. Any victory should please the fan of the home side for it has been a rare sight seeing their side win these days,West Indies won by 103 runs,ODI,WI IND,2
"It has been a comprehensive performance by England. Sri Lanka meekly surrendered after the loss of their top 4 batsmen. Only a fun filled partnership for the 9th wicket between Randiv and Malinga saved some blushes. There was no farewell innings from Jayasuriya as he ended a glittering career on a rather sombre note. Dilshan, Sangakkara and Mahela failed ro get past single figures. England bowlers, particularly Anderson proved to be rather handful under helpful conditions and were backed up by some excellent ground fielding and catching.",England won by 110 runs (D/L method),ODI,SL ENG,2
"A fine victory for Sri Lanka. It turned a bit farcical in the end with Mathews not scoring in an attempt to help Chandimal to his century, but all's well that ends well. A fine knock by the promising young talent, his 2nd in his career. Mahela Jayawardene chipped in with a sublime 79 as well.",Sri Lanka won by 6 wkts,ODI,SL ENG,2
"Half centuries from Hafeez, Misbah and Shafiq ensured an emphatic victory for Pakistan. The bowling was poor from the Windies with the exception of the young leggie Bishoo. The Windies would need to pull up their socks ahead of the next match on Monday",Pakistan won by 8 wkts,ODI,PAK WI,2
"Ahmad Shehzad overcame initial jitters and went on to compose a fine century, his second in ODIs, to complete a clinical victory. West Indies never seemed to be in the game despite keeping it tight through some steady bowling backed up by very good fielding but there was not enough fire in the attack to penetrate the strong Pakistan batting. Bishoo was the pick of the bowlers once again but lacked support from the other end.",Pakistan won by 7 wkts,ODI ,PAK WI,2
West Indies bowlers gave a good account of themselves but were left with very little to defend. Misbah showed why he is considered as the cool head of this Pakistan team with an innings of great concentration. Rampaul and young leggie Bishoo were very impressive taking the seven wickets between them,Pakistan won by 3 wkts,ODI ,PAK WI,2
"India have started their campaign with a comfortable win. Bangladesh lost their way after a furious start but it was always going to be a tall ask to maintain the tempo throughout the run chase. The ever improving Munaf provided the breakthrough initially when he sent back Kayes and Bangladesh were never really in the game after that despite fifties from Tamim and Shakib. The dew that was expected to play a part and influenced Shakib, to choose to bat first never really came in and Harbhajan aided by the back up spinners, kept the run rate under control quite easily. India will be looking to take this momentum into their next game while Bangladesh will have to pull up their socks very soon to bring some cheer to their passionate fans.",India won by 87 runs,ODI,BAN IND,2
"A clinical performance in the end by the Kiwis and they have knocked off the total in 8 overs to start their World Cup campaign in style. Their seamers did the damage by skittling out the Kenyans for a paltry 69, with Bennett taking 4 wickets and Southee and Oram sharing 3 each. Guptill and McCullum ensured they went past the target without any fuss.",New Zealand won by 10 wkts,ODI,NZ KEN,2
"Zimbabwe started off well with Coventry playing a few sweet shots, but once he was sucked in by Lee then the innings fell apart. Johnson picked up a few quick wickets and from then on it was always going to be an uphill task and it proved to be in the end. Cremer played well along with Utseya, but it was only delaying the inevitable.",Australia won by 91 runs,ODI ,AUS ZIM,2
It's been a comprehensive win to say the least. Shahid Afridi produced a blinder of a spell to rattle the Kenyan middle order and grabbed the best figures for a captain in WC games. There were no hiccups whatsoever for Pakistan as their bowlers ran through the Kenyan batting as if they had a train to catch. Collins Obuya was the only flash in the pan as he held one end up.,Pakistan won by 205 runs,ODI,KEN PAK,2
"The South Africans have started their WC campaign with a bang! West Indies have themselves to blame after their batting collapse. Darren Bravo had given them a solid platform but the Windies failed to capitalise. They came out to bowl, started well by taking two quick wickets but AB de Villiers played a scintillating knock, his 10th ODI century, to take the Proteas home comfortably with 7.1 overs to spare. Duminy and Graeme Smith also made fine contributions with the bat.",South Africa won by 7 wkts,ODI,SA WI,2
"Australia cruised home after a terrific opening partnership between Watson and Haddin yielded 133 runs. Both were in an aggressive mood looking to make the most of any small discretions in line and length by the bowlers. NZ bowlers were defending a very modest total and it was vital that they maintained pressure by taking early wickets. However, they were no match to the marauding pair who literally took each and every bowler apart. Even the normally accurate, Daniel Vettori, was not spared. The match was all but over by the time the openers were dismissed. Ponting, Clarke and White utilised the opportunity to hone their batting skills ahead of tougher challenges.",Australia won by 7 wkts,ODI,AUS NZ,2
"Sri Lanka have registered a comprehensive win after the splendid bowling performance by Malinga. Dilshan started off in a frenzy as they got off to the perfect start. Tharanga helped himself to a fifty as SL got home in a canter. Kenya will have a lot to think about in the upcoming games, while Sri Lanka have given their fans a lot to cheer about after the disappointing loss to Pakistan.",Sri Lanka won by 9 wkts,ODI,KEN SL,2
"Comprehensive is the only word that comes to mind when one describes NZ's batting performance. Guptill and Brendon McCullum never looked like getting out and the Zimbabwe bowlers struggled. Price, Utseya and Cremer kept it tight but they did not get the wickets",New Zealand won by 10 wkts,ODI,NZ ZIM,2
"One thought that this would be a match among equals but it was anything but that. West Indies have registered a comprehensive win with 226 balls to spare. Bangladesh have let themselves down completely and it will be a test of their character to come back from this demoralising defeat. For WI, the heartening aspect would be the performance of their captain Sammy who led from the front with the ball.",West Indies won by 9 wkts,ODI ,WI BAN,2
The Kenyans have showed some real character by lasting the full fifty overs. The Aussies will be a little disappointed that they could not bowl them out but a good workout nevertheless for their bowlers. They seemed to be looking at it as a practice game and have done their reputation no damage. Their unbeaten streak at WCs continues and it has now extended to 33 games. Collins Obuya will probably look back at this innings quite fondly despite missing the ton and the Kenyans do have some positives to take out from this game,Australia won by 60 runs,ODI,KEN AUS,2
"Pakistan were never in danger of losing the game and now stroll through to the quarter-finals. Asad Shafiq showed that he is a player for the future with a calm and composed knock. The Zimbabweans tried hard, but their lack of penetration in their bowling meant that they could never have envisioned hopes of a win. Pakistan were always in control and paced their chase quite beautifully to canter home.",Pakistan won by 7 wkts,ODI,PAK ZIM,2
Ireland were expected to put up a fight against SA and they did meet the expectations for some time with the ball. Duminy came in and arrested the slide and took South Africa to safety. Ireland never really recovered after the early strikes by Morkel. To their credit the South Africans never gave them any breathing space and kept it very tight throughout. They will be pleased with their bowling effort though there still seems to be slight concerns over the performance of the top order.,South Africa won by 131 runs,ODI,SA IRE,2
"A comprehensive win for Zimbabwe in the end as they end their WC campaign on a high. Winning the toss, they set a mammoth total first up and then they were backed up perfectly by Mpofu and then the spinners as they took wickets in regular intervals to trigger the collapse. In the end a poor WC for the Kenyans as they failed to secure a win all through the tournament.",Zimbabwe won by 161 runs,ODI,KEN ZIM,2
"Australia were always facing a herculean task after getting only 176. Still they came out with intent and forced the Pakistanis to earn each and every run. Lee was magnificent and if Tait and Johnson had combined together, the result could well have been very different. Still full marks to Shafiq, Younis Khan and Umar Akmal for gutsing it out and taking their side home. Umar Akmal took calculated risks and curbed his natural attacking instincts to play perhaps the most sensible innings of his life",Pakistan won by 4 wkts,ODI,PAK AUS,2
"Shambolic is what one can describe Bangladesh's exit from the 2011 World Cup. One struggled to figure out the mindset of the Bangladeshi batsmen when they walked out to bat. All played loose strokes and Tsotsobe ran through the top order with three wickets. Peterson came later on and he continued to tear into the Bangladeshi middle and lower order. Shakib was the highest scorer with 30, but none of the other batsmen could manage anything significant as Bangladesh folded up for 78, the second time that they have been bowled out for under a 100 in this World Cup.",South Africa won by 206 runs,ODI,BAN SA,2
"Ireland have truly shown that they are the best associate nation in this World Cup. They have ended the tournament on a high as they chased down a target of 300 plus in this tournament for the second time with six wickets to spare. The platform was set by Stirling and Porterfield who shared a record 177 run opening stand. Porterfield got an early reprieve when Raja dropped him on 1. Stirling scored boundaries at will as he blazed away to his century. However, the Netherlands came right back with the quick dismissals of Porterfield and Stirling. Niall O Brien came in and held the innings together, building crucial partnerships with Joyce and Wilson. It was a disappointing effort in the field from the Dutch and they go home without a single win.",Ireland won by 6 wkts,ODI,IRE NED,2
"The Aussie openers were ruthless, devastating and absolutely flawless as it rained runs at the Chinnaswamy Stadium. They started off slowly, but once they got their eye in, they took on the Canadian spinners and dispatched the ball to every possible corner. There were a couple of half chances that didn't go Canada's way and the duo made the most their hitting abilities. There was a race on who would get to his hundred first, but Haddin fell 12 runs short and he was dismissed at the fag end of the innings. Watson wanted to get to his hundred with a six and threw away his wicket. Ponting's misery continued as he failed to middle the ball yet again.",Australia won by 7 wkts,ODI,AUS CA,2
"A strange little match which never rose above the levels of mediocrity finally ends. Sri Lanka huffed and puffed their way to 236, not showing any intent even during the slog overs. Chandimal was the star with a fine 92. The chase was methodical as each and every batsman made handy contributions. JPD and Amla made fifties to anchor a good chase. The visitors have all the work to do ahead of the next 3 matches with the hosts sitting pretty at 2-0",South Africa won by 5 wkts,ODI,SL SA,3
"A convincing win in the end for Pakistan, but it was not without nerves. It took that man, Afridi, to come out and get his team past the winning mark. Misbah was ice cool until the end. Mohsin Khan will be worried with the way the chase went about. They will be happy with the win though. They go 1-0 up with two games to go. Another poor effort from the Bangladeshi batsmen. The lack of application has been their undoing all these years and it continues to haunt them. The bowlers did well to make a match in the end, but you cannot expect them to win matches from near impossible situations.",Pakistan won by 5 wkts,ODI,PK BAN,3
"The match was decided after just 10 overs of the chase when Bangladesh were reduced to 19/4. Shakib Al Hasan played a patient innings of 34, but it was the 20 year old Nasir who will take all the plaudits for scoring his first ODI ton. He became just the 2nd Bangladesh player to score a 100 against Pakistan, the 1st one being Shakib Al Hasan. Pakistan seemed to take it easy towards the end but all credit to the youngster for his fab effort. This is their 21st straight win against the hosts and they take the series 2-0.",Pakistan won by 76 runs,ODI,PK BAN,3
"A clinical performance from Pakistan today and their domination against the Lankans continues. After electing to bat, the Lankans got off to a poor start as the Pakistani seamers bowled a tight line and didn't give anything away. But the introduction of spinners triggered the collapse and they never came back after they lost wickets at regular intervals. Only Chandimal played steadily, but got out at a crucial time and the rest of the tail couldn't manage to get going. It was an easy chase for Pakistan and they did it in style with Farhat and Younis notching up their fifties and seeing them through",Pakistan won by 8 wkts,ODI,PK SL,3
